Micro LED供电系统技术,电源、连接线,9,开发高效供电方案以支持Micro LED显示。,博通、德州仪器,National Instruments、Semantics,https://www.ni.com/,,
Micro LED桌面显示技术,桌面显示器、连接器,10,为个人计算机提供高分辨率的显示解决方案。,华硕、戴尔,PCMag、AnandTech,https://www.pcmag.com/,,
Micro LED生产线自动化,机器人、自动化软件,10,用自动化提高Micro LED生产效率。,ABB、KUKA,Automation World、Robotics Business Review,https://www.automationworld.com/,,
Micro LED生态系统平台,平台软件、开发工具,9,支持Micro LED技术的开发和合作的生态系统。,英特尔、Google,Forbes、Engadget,https://www.forbes.com/,,
Micro LED照明技术,LED芯片、散热器,8,在照明领域提升能效和光质的创新技术。,GE照明、合作伙伴,Lighting Europe、刊物,https://www.lighting-europe.org/,,
Micro LED电池管理技术,电池模块、监控设备,9,提升Micro LED装置所需的电池效率。,Tesla、特斯拉能源,Energy Reports、CleanTechnica,https://www.cleantechnica.com/,,
Micro LED维护技术,维护工具、诊断软件,7,为Micro LED产品提供有效维护和服务方案。,福特、维保机器人,Facilities management、Property Management,https://www.fmlink.com/,,
Micro LED云技术,服务器、网络设备,10,利用云技术提升Micro LED应用的灵活性和可扩展性。,Amazon AWS、Microsoft Azure,Cloud Computing News、TechTarget,https://www.techtarget.com/,,
Micro LED营销解决方案,数据分析软件、广告工具,8,提高基于Micro LED的广告显示的效果。,Adobe、Salesforce,Marketing Tech News、AdWeek,https://www.adweek.com/,,
Micro LED公路显示,显示器框架、尤其光材料,9,为交通指示和广告显示提供应用。,Clear Channel Outdoor、数字标牌公司,Digital Signage Today、OAAA,https://www.oaaa.org/,,
Micro LED深度学习模型,算法、数据集,10,将深度学习应用于Micro LED的应用程序优化。,NVIDIA、OpenAI,AI Technologies、MIT Technology Review,https://www.technologyreview.com/,,
Micro LED用户体验技术,用户界面、互动设备,9,提升Micro LED设备的用户交互体验。,Apple、微软,User Experience Magazine、NNG Group,https://www.nngroup.com/,,
Micro LED显示模组设计,显示面板、模组控制器,9,设计用于集成多种显示功能的Micro LED模组,LG Display、天马微电子,Display Supply Chain Consultants,https://www.dsc.com/,,
Micro LED照明技术,光源模块、散热系统,8,利用Micro LED实现高能效的照明解决方案,欧司朗、晶电,Lighting Europe、MarketsandMarkets,https://www.lightingeurope.org/,,
Micro LED智能可穿戴设备,显示屏、传感器,9,结合Micro LED与智能传感技术的穿戴设备,Apple、华为,IDC、Counterpoint Research,https://www.idc.com/,,
Micro LED显示屏校准技术,测试仪器、软件算法,8,对Micro LED显示屏进行高精度校准提高显示效果,Visionox、信利光电,China National Information Center,http://www.cnic.cn/,,
Micro LED虚拟现实显示,显示单元、耳机壳体,10,将Micro LED技术应用于虚拟现实头显设备,Meta、HTC,Virtual Reality Society,https://www.vrs.org.uk/,,
Micro LED医用显示技术,显示面板、影像处理器,9,优化影像显示在医学领域的应用效果,佳能医疗、飞利浦医疗,Medical Device and Diagnostics Industry,https://www.mddionline.com/,,
Micro LED自组织技术,光敏材料、集成电路,9,促进Micro LED的自我组装与生产,麻省理工学院、华为,Nature、IEEE Journal,https://www.nature.com/,,
Micro LED光学增强技术,反射镜、透镜,8,提升Micro LED显示的亮度和对比度,三星、镭驰科技,Optics Express、SPIE,https://www.spiedigitallibrary.org/,,
Micro LED次表面技术,底板、连接器,8,对下一代Micro LED显示技术的底层基础进行改进,日本技术研究所、薄膜技术公司,Journal of Applied Physics、Electronics Letters,https://iopscience.iop.org/,,
Micro LED全息显示,全息片、投影系统,10,实现高质量的全息影像显示,英特尔、拜腾,Holography Society、TechCrunch,https://techcrunch.com/,,
Micro LED存储技术,存储芯片、数据处理单元,7,探索Micro LED在数据存储中的应用潜力,英伟达、群联电子,TechRadar、StorageReview,https://www.techradar.com/,,
Micro LED沉浸式体验,沉浸式展示设备、控制系统,9,结合环境感知和Micro LED应用于沉浸式场景,索尼、阿里巴巴,Immersive Tech Alliance、Forrester Research,https://immersivetechalliance.com/,,
Micro LED信号处理技术,信号调理器、传感器,9,对Micro LED信号进行高效处理和优化传输,西门子、意法半导体,Signal Processing Society、EDN Network,https://www.edn.com/,,
Micro LED环形显示技术,环形屏幕、数据链路,7,通过环形显示技术增强视觉体验,LG、飞利浦,Consumer Electronics Association、Display Week,https://www.ce.org/,,
Micro LED无线能量传输,能量接收板、传输线圈,8,通过无线技术为Micro LED设备供电,特斯拉、华为,Wireless Power Consortium、IEEE PELS,https://www.wirelesspowerconsortium.com/,,
Micro LED纳米材料研究,纳米级别材料、制备设备,8,探索微观材料在Micro LED技术中的应用,清华大学、苏州大学,Materials Today、Advanced Materials,https://www.materialstoday.com/,,
Micro LED软件算法优化,图像处理器、优化算法,9,开发高效的软件算法以提升Micro LED显示质量,Google、猎豹移动,Artificial Intelligence Review、IEEE Transactions,https://link.springer.com/journal/10462,,
Micro LED显示技术,显示模块、驱动电路,10,采用Micro LED技术提升显示亮度和色彩对比度。,LG电子、富士康,Consumer Technology Association、DisplayWeek,https://www.displayweek.org/,,
Micro LED智能穿戴设备,显示屏、微控制器,9,在智能手表和健身设备中实现四色Micro LED显示。,Apple、华米科技,Wearable Tech World、TechCrunch,https://techcrunch.com/,,
Micro LED光源技术,光源板、电源管理IC,8,用于创建高亮度和可调色温的灯具。,Osram、日亚化学,Lighting Europe、LED Magazine,https://www.ledsmagazine.com/,,
Micro LED护目镜技术,微型显示器、可调镜片,8,在护目镜中集成高分辨率Micro LED显示。,JBL、三星,Augmented Reality News、AR Post,https://arpost.co/,,
Micro LED智能家居,控制模块、分布式LED,9,实现智能家居设备中的动态显示与控制。,小米、Philips Hue,Smart Home Magazine、Gartner,https://www.gartner.com/,,
Micro LED工业显示屏,显示屏、信号转换器,10,用于工业监控和数据可视化的高效显示方案。,西门子、施耐德电气,Industrial Electronics、Automation World,https://www.automationworld.com/,,
Micro LED 电脑显示器,显示面板、接口电路,9,在个人电脑显示器中利用Micro LED提升显示效果。,宏碁、华硕,PC Magazine、AnandTech,https://www.pcmag.com/,,
Micro LED汽车显示系统,仪表板显示器、HUD,10,集成到汽车仪表和抬头显示中，实现清晰可视的驾驶信息。,特斯拉、奔驰,Automotive News、Car and Driver,https://www.autonews.com/,,
Micro LED户外广告屏,户外显示单元、控制系统,8,建设高亮度户外广告显示屏，实现动态内容展示。,阿里巴巴、信息科技公司,Advertising Age、Billboard,https://adage.com/,,
Micro LED虚拟现实显示,头盔显示器、传感器,10,在虚拟现实设备中实现沉浸式体验。,Oculus、HTC,Virtual Reality Society、Road to VR,https://www.roadtovr.com/,,
Micro LED健康监测设备,传感器、显示组件,7,集成到健康监测设备中，实时数据可视化。,Samsung Health、Fitbit,HealthTech Magazine、MobiHealthNews,https://www.mobihealthnews.com/,,
Micro LED教育应用,多媒体显示设备、教学系统,8,在学校和教育环境中增强教学效果的显示技术。,宏碁、联想,EdTech Magazine、Education Technology Solutions,https://edtechmagazine.com/,,
Micro LED面板制造技术,制造设备、测试设备,10,提高Micro LED面板生产的效率与质量。,京东方、友达光电,Display Daily、Global Semiconductor Alliance,https://www.displaydaily.com/,,
Micro LED通信技术,调制解调器、信号处理模块,7,通过Micro LED技术实现高速数据传输。,华为、中兴通讯,Telecoms.com、Fierce Wireless,https://www.fiercewireless.com/,,
Micro LED多用途显示技术,模块显示屏、通讯接口,9,应用于各种场合的可自定义显示解决方案。,佳能、索尼,Display Magazine、TechRadar,https://www.techradar.com/,,
Micro LED视频监控技术,传感器模块、视频显示器,10,在安全监控系统中实现高清视频显示。,海康威视、宇视科技,Security World、CCTV Information,https://www.cctvinfo.com/,,
Micro LED临床显示技术,医疗显示器、图像处理算法,9,在医学成像中提供高分辨率显示，帮助诊断。,飞利浦医疗、GE医疗,Medical Imaging Magazine、Health Affairs,https://www.healthaffairs.org/,,
Micro LED触控显示技术,触控面板、光学玻璃,9,允许用户通过触摸直接操作显示内容的数字显示技术,三星电子、LG Display,Market Research Future,https://www.marketresearchfuture.com/,,
Micro LED夜视技术,低光传感器、增强镜头,8,在低光环境下仍能清晰显示图像的技术,索尼、传感器公司,Photonics.com,https://www.photonics.com/,,
Micro LED照明解决方案,光源单元、散热器,9,提高室内照明效果的Micro LED采用技术,飞利浦照明、欧普照明,Lighting Europe,https://www.lightingeurope.org/,,
Micro LED柔性显示技术,柔性基板、胶粘剂,10,为可穿戴设备提供弯曲显示屏的技术,LG Display、三星电子,Display Supply Chain Consultants,https://www.displaymate.com/,,
Micro LED医疗显示技术,监控器、传感器,9,用于医疗成像显示的高清晰度技术,飞利浦、GE医疗,Medical Device Network,https://www.medicaldevicenetwork.com/,,
Micro LED数据传输技术,数据接收器、信号处理器,8,加强Micro LED显示器之间数据通信的技术,高通、英特尔,IEEE Xplore,https://ieeexplore.ieee.org/,,
Micro LED极简设计技术,轻质框架、现代设计材料,7,优化Micro LED显示器外观的设计理念,苹果、华为,TechCrunch,https://techcrunch.com/,,
Micro LED新型封装技术,封装材料、保护膜,9,通过改进封装技术提高Micro LED可靠性的方案,台积电、英特尔,Electronics Weekly,https://www.electronicsweekly.com/,,
Micro LED多色彩控制技术,颜色调节模块、控制芯片,10,针对Micro LED显示器的颜色精确管理,索尼、Samsung Display,CNet,https://www.cnet.com/,,
Micro LED低功耗技术,电源管理单元、能耗监测仪,10,降低Micro LED显示器功耗的创新解决方案,华为、联发科,Green Tech Media,https://www.greentechmedia.com/,,
Micro LED环保材料开发,可再生基板、生态型粘合剂,8,使用绿色材料生产Micro LED设备的技术,LG Electronics、索尼,Sustainable Materials,https://www.sustainablematerials.com/,,
Micro LED市场预测分析,分析工具、市场数据,8,为Micro LED产业未来发展提供数据支持,Mordor Intelligence、ResearchAndMarkets,MarketWatch,https://www.marketwatch.com/,,
Micro LED系列产品整合技术,产品集成平台、应用程序,9,整合不同Micro LED产品以提供完整解决方案,京东方、群创光电,Display Today,https://www.displaytoday.com/,,
Micro LED设备容错技术,冗余模块、故障监测系统,8,提高Micro LED设备运行稳定性的技术,优派、宏碁,TechRepublic,https://www.techrepublic.com/,,
Micro LED集成软件开发,软件开发包、调试工具,9,开发支持Micro LED技术的嵌入式软件,IBM、微软,Software Engineering Daily,https://softwareengineeringdaily.com/,,
Micro LED冷却技术,冷却风扇、液体冷却系统,8,为Micro LED提供系统冷却以延长使用寿命,英伟达、超级计算机公司,TechTarget,https://www.techtarget.com/,,
Micro LED透明显示技术,透明基板、电子元件,10,实现透明显示效果的先端技术,LG Display、三星,Display Daily,https://www.displaydaily.com/,,
Micro LED智能玻璃科技,光学涂层、传感器,9,将Micro LED技术集成进智能窗户，优化能效与可视性。,德尔惠、施耐德电气,Smart Glass Journal,https://www.smartglassjournal.com/,,
Micro LED无线显示技术,无线传输模块、接收器,10,实现Micro LED显示屏的无缝无线传输。,苹果公司、三星电子,IEEE Transactions on Broadcasting,https://ieeexplore.ieee.org/,,
高亮Micro LED应用,LED芯片、散热片,8,提升Micro LED在强光环境下的显示效果。,LG电子、诺基亚,Display Technology Reports,https://www.displaytechnologyreports.com/,,
Micro LED全景显示技术,拼接模块、软屏材料,9,打造超大尺寸、无缝拼接的Micro LED显示系统。,华为、创维,AVS Forum,https://www.avsforum.com/,,
Micro LED互动屏幕技术,触控模块、数字信号处理器,10,在Micro LED屏幕上实现高效的触控响应与交互。,Oculus、微软,Interaction Design Foundation,https://www.interaction-design.org/,,
Micro LED灵活显示技术,柔性基板、导电材料,9,实现Micro LED的柔性应用，适应不同形状的设备。,索尼、京东方科技,Flexible Electronics Reports,https://www.flexibleelectronicsreports.com/,,
Micro LED家庭影院技术,投影仪模块、音频集成,8,将Micro LED技术应用于家庭影院的高清显示。,飞利浦、富士康,Home Theater Review,https://www.hometheaterreview.com/,,
Micro LED健康监测显示技术,生物传感器、监测屏幕,9,用于健康监测设备中的Micro LED显示技术。,Fitbit、华大基因,HealthTech News,https://www.healthtechnews.com/,,
Micro LED耐高温显示技术,热管理系统、耐高温LED,8,在极端温度环境下稳定显示Micro LED画面。,墨西哥国家大学、江苏长江,Extreme Environment Technology Journal,https://www.extremeenvironmenttechnologyjournal.com/,,
Micro LED自动亮度调节技术,环境光传感器、亮度调节IC,9,自动根据环境光变化调节Micro LED显示亮度。,华为、松下电器,Journal of Display Technology,https://www.displayjournal.com/,,
Micro LED夜视显示技术,红外控制芯片、光电探测器,10,用于夜视设备的Micro LED显示技术。,Raytheon、洛克希德·马丁,Military Electronics Reports,https://www.militaryelectronicsreports.com/,,
Micro LED运动相机技术,高清图像传感器、快门设备,8,将Micro LED应用于运动相机，使其具备更好的画质。,GoPro、索尼,Action Camera Reviews,https://www.actioncamerareviews.com/,,
Micro LED负载检测技术,负载传感器、信号转换器,9,在Micro LED屏幕中实现负载检测功能。,施耐德、西门子,Electronic Sensor News,https://www.electronicsensorews.com/,,
Micro LED多视角技术,视角优化透镜、多重显示技术,7,提供多角度观看的Micro LED显示解决方案。,飞利浦、三星,Advanced Display Systems,https://www.advanceddisplaysystems.com/,,
Micro LED透明显示技术,透明基板、支持电子电路,10,利用Micro LED实现高度透明的显示效果，适用于广告和展示。,LG Display、瑞士电子,Transparent Display News,https://www.transparentdisplaynews.com/,,
Micro LED电源管理技术,电源模块、稳压芯片,8,提高Micro LED显示的电源使用效率与安全性。,德州仪器、安森美半导体,Power Management Journal,https://www.powermanagementjournal.com/,,
Micro LED网络协同显示技术,网络模块、边缘计算器,9,通过网络连接多个Micro LED显示屏，实现协同显示。,思科、爱立信,Network World,https://www.networkworld.com/,,
Micro LED广告显示技术,显示面板、信息传输模块,9,用于商业广告的高画质Micro LED显示解决方案。,时代华纳、索尼,Advertising Weekly,https://www.advertisingweekly.com/,,
Mini LED融合技术,光源模块、控制系统,9,在未来电视和显示器中提升对比度及色彩表现。,LG电子、三星显示,Display Industry News、LED Journal,https://www.displayindustrynews.com/,,
Micro LED显示封装技术,封装材料、测试设备,8,提高Micro LED单元的稳定性与耐久性。,艾默生、通用电气,TechCrunch、Yahoo Finance,https://www.techcrunch.com/,,
Micro LED冷却系统,冷却装置、热传导材料,7,优化Micro LED的散热管理，提升使用寿命。,航天机电、瑞萨电子,Scientific American、MIT Technology Review,https://www.scientificamerican.com/,,
Micro LED供电技术,电源管理芯片、连接线,9,确保Micro LED在高性能状态下的稳定供电。,高通、台积电,EE Times、Microelectronics Journal,https://www.eetimes.com/,,
可弯曲Micro LED技术,柔性基材、粘合剂,8,实现可动态变形的显示解决方案。,索尼、三星电子,GIZMODO、Wired,https://www.wired.com/,,
Micro LED透明屏幕技术,透明玻璃、显示模块,10,用于建筑和广告的新一代显示解决方案。,飞利浦、京东方科技,Display Week、Innovative Display,https://www.displayweek.org/,,
Micro LED显示器校准技术,传感器、软件工具,8,确保显示器输出的色彩与亮度达到行业标准。,Adobe、佳能,Color Science Journal、TechRadar,https://www.techradar.com/,,
3D Micro LED显示技术,3D成像模块、图像处理器,9,提升视觉体验，在全息和虚拟现实应用中的展示。,苹果、英伟达,VR Tech、3D Printing Industry,https://www.3dprintingindustry.com/,,
Micro LED高光效技术,灯具、反射材料,9,提高显示和照明设备的能效与视距。,欧司朗、日亚化学,LEDs Magazine、Energy Efficiency Journal,https://www.ledsmagazine.com/,,
Micro LED量产技术,生产线、自动化设备,10,大规模生产Micro LED的核心技术。,索尼、三星显示,Industry Week、Manufacturing Today,https://www.industryweek.com/,,
Micro LED环境适应技术,防水外壳、适应性传感器,8,使Micro LED产品在各种恶劣环境中都能正常工作。,德州仪器、霍尼韦尔,Electronics Weekly、Environmental Protection Agency,https://www.electronicsweekly.com/,,
Micro LED无线传输技术,无线模块、信号增强器,9,实现Micro LED设备的无线数据传输与连接。,高通、联发科,Wireless Technology News、IEEE Transactions,https://ieeexplore.ieee.org/,,
Micro LED多屏拼接技术,拼接模块、控制器,8,可扩展的显示解决方案，用于商业与公共空间。,创维、美的,AV Network、Commercial Integrator,https://www.avnetwork.com/,,
Micro LED运动追踪技术,运动传感器、控制板,7,提升互动游戏和体育转播中的显示效果。,微软、任天堂,Game Developer、Tech Insight,https://www.gamedeveloper.com/,,
Micro LED量子点技术,量子点材料、增益介质,9,结合量子点技术提升显示器的色域和亮度。,Vizio、TCL,Quantum Dot Forum、Display Technology Trends,https://www.quantumdotforum.com/,,
Micro LED适应性显示技术,自适应算法、显示控制器,8,Dynamic adjustment of brightness and contrast according to surroundings.,英特尔、AMD,Tech Blogs、Future Insights,https://www.techblogs.com/,,
Micro LED可穿戴技术,微型显示器、传感器,9,在智能手表和健康设备中提供视觉信息。,Fitbit、小米,Wearable Technology、Health Tech Insights,https://www.wearabletechnology.com/,,
Micro LED屏幕校准技术,校准设备、软件工具,9,为Micro LED显示屏提供精准的颜色和亮度校准解决方案。,LG电子、锐达科技,DisplayMate、专业显示研究,https://www.displaymate.com/,,
Micro LED柔性显示技术,柔性电路板、粘合剂,9,开发用于可穿戴设备和折叠屏幕的柔性Micro LED显示技术。,苹果、三星显示,TechCrunch、行业动态,https://techcrunch.com/,,
Micro LED生态监测技术,传感器模组、数据收集系统,8,对Micro LED显示器的生态环境进行监测，以提高性能与耐用性。,索尼、海信,清华大学、可持续发展研究,https://www.tsinghua.edu.cn/,,
Micro LED家庭影院应用,投影仪、音响系统,10,将Micro LED技术引入家庭影院，为用户提供沉浸式观影体验。,飞利浦、乐视,CNET、电子产品评论,https://www.cnet.com/,,
Micro LED自动化检测技术,图像传感器、检测软件,9,利用自动化方式检测Micro LED产品的质量，提升生产效率。,德州仪器、伊顿,Automation World、智能制造,https://www.automationworld.com/,,
Micro LED触觉反馈技术,触觉设备、反馈源,8,为用户提供基于Micro LED界面的触觉反馈技术。,微软、猫眼科技,TechRadar、未来科技趋势,https://www.techradar.com/,,
Micro LED光通信技术,光解调器、收发器,8,将Micro LED用于高速光通信的技术，提升数据传输速率。,华为、TP-Link,光通信发展论坛、电子通信协会,https://www.icea.org/,,
Micro LED生物发光显示技术,生物材料、显示基板,7,采用生物材料实现的Micro LED显示技术，环保且高效。,诺华、万华化学,生物技术杂志、HEC研究平台,https://www.elsevier.com/journals,,
Micro LED空间成像技术,成像传感器、镜头,9,基于Micro LED实现的三维空间成像技术，广泛应用于虚拟现实。,Google、Meta,VR Focus、虚拟现实协会,https://www.vrfocus.com/,,
Micro LED能源管理技术,能量收集装置、控制系统,8,提升Micro LED屏幕的能源效率，延长电池使用时间。,特斯拉、宁德时代,能效监督局、绿色技术论坛,https://www.energy.gov/,,
Micro LED健康监测技术,健康传感器、数据分析软件,8,将Micro LED用于健康监测设备，实时跟踪生理数据。,小米、Fitbit,健康技术杂志、医疗器械研究,https://www.healthcareitnews.com/,,
Micro LED室内定位技术,定位设备、导航软件,7,为室内空间提供高精度定位和导航服务的Micro LED技术。,阿里巴巴、百度,室内定位学会、市场调查报告,https://www.indoorlocate.com/,,
Micro LED户外显示技术,抗晒材料、耐候外壳,9,专为户外环境设计的Micro LED显示解决方案，提升可视性与耐用性。,Samsung、创维,户外广告协会、显示技术研究,https://www.outdooradassociation.org/,,
Micro LED演示工具,演示设备、交互系统,8,开发用于企业和教育领域的Micro LED演示工具，增强互动性。,Microsoft、飞利浦,企业技术博览、教育科技协会,https://edtechjournal.com/,,
Micro LED储能显示技术,储能装置、控制面板,10,集成储能解决方案与Micro LED显示技术，为用户提供环保的显示解决方案。,GoPro、美国能源部,可再生能源研究、清洁技术协会,https://www.energy.gov/,,
Micro LED指纹识别技术,指纹传感器、解锁模块,9,结合Micro LED技术实现安全高效的指纹识别，广泛应用于移动设备。,苹果、三星电子,移动安全研究、技术评测网,https://www.mobilesecurity.org/,,
Micro LED动态更新技术,更新系统、缓存设备,7,实现Micro LED显示内容的动态更新及管理，提高用户体验。,华为、广达电脑,IT世界、用户体验研究,https://www.itworld.com/,,
Micro LED互动显示技术,传感器、控制面板,9,支持多用户互动的Micro LED显示技术，适用于展会和教育领域。,LG Display、兆易创新,Interactive Tech Insights、EDC Reports,https://www.edc-reports.com/,,
Micro LED健康监测显示技术,生物传感器、显示模块,8,用于健康监测的Micro LED显示技术，具有高度灵敏的生物传感能力。,Apple、Fitbit,Health Technology Journal、Statista,https://www.healthtechjournal.com/,,
Micro LED柔性显示屏技术,柔性电路、蓝光LED,10,开发柔性Micro LED显示屏，适合于可穿戴设备和移动设备。,三星电子、华为,Display Daily、IDTechEx,https://www.displaydaily.com/,,
Micro LED视网膜显示技术,微型透镜、显示晶元,9,模拟人眼视网膜的显示技术，提供超高清晰度的视觉体验。,Sony、松下,Vision Tech、OLED Association,https://www.oled-info.com/,,
Micro LED驱动器技术,高效驱动IC、信号处理单元,10,实现对Micro LED显示器的高效驱动与控制。,德州仪器、数联科技,Semiconductor Digest、EDA方面的研究,https://www.semiconductordigest.com/,,
Micro LED封装技术,封装材料、热管理元件,8,提升Micro LED显示模块的性能与寿命的关键封装技术。,立讯精密、英特尔,Packaging Technology Journal、SPIE,https://www.spie.org/,,
Micro LED环境适应技术,传感器组件、调光模块,7,适应不同环境光线条件的Micro LED显示技术。,飞利浦、VEGA,Environmental Display Research、Tech Review,https://www.techreview.com/,,
Micro LED系统集成技术,系统板、控制单元,9,实现Micro LED显示系统的整体集成与优化。,京东方、联发科,System Integration News、Gartner,https://www.gartner.com/,,
Micro LED智能家居应用技术,智能控制器、LED模组,8,在智能家居设备中集成Micro LED技术，提高用户交互体验。,小米、亚马逊,Smart Home Research、GfK,https://www.gfk.com/,,
Micro LED技术推广与普及,培训材料、推广工具,6,提升市场对Micro LED技术认识与使用的推广措施。,深圳市微智、光明科技,Market Research China、Nielsen,https://www.nielsen.com/,,
Micro LED电源管理技术,电源IC、智能电源模块,8,优化Micro LED显示设备的电源使用效率，延长使用寿命。,安森美、ON Semiconductor,Power Management Journal、Electronics Weekly,https://www.electronicsweekly.com/,,
Micro LED多媒体展示技术,显示墙组件、控制软件,9,用于大型活动与展览的高清Micro LED展示系统。,亚联科技、视源股份,AV Technology、Media Server 环境,https://www.avnetwork.com/,,
