机器人类型,主要结构,特点,常见应用,数据类型,采集来源,来源链接,采集时间,备注【疑问汇总】
远程医疗机器人,移动手术台,高精度操作、远程监控,远程医疗诊断,字符型,国家医学科学院,https://www.nma.gov.cn,,
建筑机器人,自动铺设系统,效率高、精准施工,大型建筑工程,字符型,建筑行业协会,https://www.buildingassociation.org,,
探险机器人,越野行走系统,环境适应性、数据采集,极地探险、宇宙探索,字符型,探索科技研究院,https://www.explorationtech.org,,
物流机器人,自主移动平台,路径规划、自动加载,仓储物流,字符型,中国物流与采购联合会,https://www.chinawuliu.com,,
娱乐机器人,社会化交互系统,语音识别、情感反馈,家庭娱乐、陪伴,字符型,国家广播电视总局,https://www.sapprft.gov.cn,,
医疗机器人,手术辅助臂,远程操作、视频反馈,远程医疗、手术辅助,字符型,医学界,https://www.medicalworld.com,,
清洁机器人,全自动吸尘系统,智能路径规划、自动充电,家庭清洁,字符型,国际家电博览会,https://www.applianceworld.com,,
农业机器人,智能播种机,精准施肥、作物监测,现代农业,字符型,农业科技期刊,https://www.agriculturejournal.com,,
教育机器人,智能学习系统,自适应学习、互动性强,学前教育、编程教育,字符型,中国教育科学研究院,https://www.nie.edu.cn,,
特种机器人,火灾救援设备,高温耐受、遥控操作,火灾现场救援,字符型,国家消防救援局,https://www.msa.gov.cn,,
服务机器人,社交型移动平台,智能交互、语音助手,酒店、商场导览,字符型,国际服务机器人协会,https://www.servicerobotics.org,,
制造机器人,协作机械臂,高度协作、灵活性高,小批量生产,字符型,中国自动化学会,https://www.caas.org.cn,,
无人机,多旋翼飞行器,实时数据传输、高度灵活,农业监测、快递投递,字符型,中国无人机产业发展协会,https://www.uav.org.cn,,
服务机器人,移动平台,语音识别、远程控制,老年人照护、酒店服务,字符型,中国智能服务机器人产业联盟,https://www.csria.org,,
仓储机器人,自主导航平台,高效搬运、路径优化,物流仓储、配送中心,字符型,阿里巴巴智能物流部,https://www.alibaba.com,,
医疗机器人,机器人手术系统,实时影像反馈、精准手术,微创手术、远程手术,字符型,国际医疗机器人协会,https://www.iamrobotics.org,,
娱乐机器人,智能交互体,情感识别、游戏功能,儿童教育、家庭娱乐,字符型,国内玩具行业协会,https://www.toyassociation.org,,
农业机器人,多功能农业平台,实时数据分析、精准施肥,智能温室、农田管理,字符型,国家农业信息中心,https://www.naiic.gov.cn,,
研究机器人,模块化实验平台,数据模拟、环境感知,科学研究、技术开发,字符型,中国科学院,https://www.cas.cn,,
特种机器人,救援机器人平台,实时传输、抗压性能强,灾后救援、勘测,字符型,国家消防救援机构,https://www.119.gov.cn,,
教育机器人,可编程智能演示机,培养编程能力、互动学习,STEM教育、编程课程,字符型,教育部科技处,https://www.moe.gov.cn,,
无人机,四旋翼结构,高空拍摄、数据传输,农业监测、景观拍摄,字符型,中国无人机协会,https://www.drone.org.cn,,
家用清洁机器人,扫地机器人,自动清扫、智能避障,家居清洁、宠物毛发清理,字符型,家电网,https://www.jiadianw.com,,
工业机器人,并联机器人,高速、高精度,组装、包装,字符型,自动化技术,https://www.automation.com,,
服务机器人,轮式移动平台,语音识别、智能互动,酒店接待、导览,字符型,科技日报,https://www.stdaily.com,,
医疗机器人,微创外科机器人,小型、高控制精度,腔镜手术,字符型,中国医学科学院,https://www.cams.ac.cn,,
农业机器人,遥控无人机,精准播种、施肥,农业喷洒,字符型,中国农业大学,https://www.cau.edu.cn,,
特种机器人,水下机器人,深水探测、强适应性,海洋研究、救援,字符型,国家海洋局,https://www.soha.gov.cn,,
教育机器人,可编程积木,趣味性、互动性,编程启蒙教育,字符型,全国教育科学规划,https://www.dongfangzhigu.com,,
物流机器人,自动驾驶小车,仓库管理、智能调度,物品搬运,字符型,智能物流,https://www.intelligentlogistics.com,,
娱乐机器人,智能玩具,情感互动、学习功能,儿童教育、互动娱乐,字符型,消费电子协会,https://www.ce.org,,
安防机器人,四轮移动平台,实时监控、自动巡逻,公共安全、监控,字符型,国家公安部,https://www.mps.gov.cn,,
医疗辅助机器人,智能康复手臂,协助康复、灵活调节,病后恢复训练,字符型,中国健康促进与教育协会,https://www.china-health.org.cn,,
物流机器人,移动导航系统,路径优化、智能调度,仓库物流、货物配送,字符型,中国物流与采购联合会,https://www.chinawuliu.com,,
服务机器人,人形设计,社交互动、情感识别,老年护理、教育辅导,字符型,机器人时代,https://www.robotimes.com,,
工业机器人,平面关节结构,高负载、稳定性强,重工业、制造业,字符型,中国机械工业集团,https://www.sinomach.com.cn,,
医疗机器人,远程操作系统,远程操控、实时反馈,远程手术、病患监护,字符型,中国医学科学院,https://www.cams.cn,,
农业机器人,多功能传感器,自动施肥、病虫害检测,农业生产、环境监测,字符型,中国农业科学院,https://www.caas.cn,,
教育机器人,增强现实功能,沉浸式学习、个性化辅导,编程教育、STEM教育,字符型,全国教育技术标准委员会,https://www.edtech.cn,,
特种机器人,全地形底盘,适应复杂环境、抗震,军事侦察、灾害救援,字符型,国防科技大学,https://www.nudt.edu.cn,,
家庭机器人,集成传感器系统,多功能、智能家居控制,家务管理、安防监控,字符型,智能家居协会,https://www.smarthome.org.cn,,
社交机器人,旋转关节,语音沟通、行为学习,社交陪伴、情感交流,字符型,中国人工智能产业发展联盟,https://www.caai.cn,,
清洁机器人,智能导航模块,自主清扫、污垢识别,家庭清洁、商业场所,字符型,国际清洁设备协会,https://www.icd.org,,
物流机器人,自动导航系统,实时定位、路径优化,仓储管理、配送,字符型,智能物流协会,https://www.logistics.org.cn,,
娱乐机器人,轮式移动底盘,多媒体互动、娱乐,家庭娱乐、儿童教育,字符型,中国玩具和婴童用品协会,https://www.ctjta.org,,
维修机器人,移动平台+检测装置,高效维修、数据采集,设备维护、巡检,字符型,机器学习研究中心,https://www.mlresearch.org,,
安保机器人,轮式巡逻系统,智能监控、远程控制,公共安全、设施保护,字符型,公安部,https://www.mps.gov.cn,,
餐饮机器人,旋转机械手臂,快餐制作、自动配送,餐厅、咖啡厅,字符型,中国餐饮协会,https://www.ccfa.com.cn,,
救援机器人,四轮驱动系统,地形适应、远程操控,自然灾害救援、紧急救助,字符型,国家减灾委员会,https://www.ndrcc.gov.cn,,
护老机器人,交互式服务平台,人机互动、健康监测,养老院、家庭护理,字符型,国家老龄工作委员会,http://www.cnag.gov.cn,,
建筑机器人,工业机械臂,高精度施工、自动化,建筑施工、基础设施,字符型,中国建筑业协会,http://www.ceca.org.cn,,
运输机器人,无人驾驶平台,高效运输、低能耗,城市配送、工厂内部运输,字符型,中国智能交通协会,https://www.cita.org.cn,,
虚拟现实机器人,兼容VR设备,沉浸式体验、用户交互,教育培训、游戏娱乐,字符型,中国虚拟现实产业联盟,http://www.vria.org,,
工业机器人,SCARA机械手,高速度、精确控制,电子装配、包装,字符型,中国电子科技集团,https://www.cetc.com,,
服务机器人,智能移动平台,语音识别、情感交互,老人陪护、公共服务,字符型,中国科学院自动化研究所,https://www.ia.cas.cn,,
农业机器人,无人驾驶拖拉机,精准耕作、数据采集,土地耕种、作物监测,字符型,中国农业大学,https://www.cau.edu.cn,,
医疗机器人,手术导引系统,远程操作、实时反馈,远程手术、训练辅助,字符型,中国医学科学院,https://www.cams.ac.cn,,
教育机器人,智能编程平台,开源编程、模块化,青少年编程教育,字符型,国家教育考试服务中心,https://www.neea.edu.cn,,
特种机器人,高空作业平台,稳定性强、可载重,建筑施工、维护,字符型,国际特种机器人技术协会,https://www.surveyor.com,,
物流机器人,自主导航小车,高效路径规划、实时定位,仓储物流、配送,字符型,中国物流与采购联合会,http://www.clp.edu.cn,,
娱乐机器人,智力互动模型,趣味编程、亲子互动,亲子互动、娱乐教育,字符型,中国玩具协会,http://www.ctia.com.cn,,
水下机器人,多功能探测器,深海探测、数据传输,环保监测、海洋探索,字符型,国家海洋局,http://www.soa.gov.cn,,
家庭机器人,嵌入式控制系统,智能家居管理、日常协助,家庭助手、智能家居,字符型,国家经济和信息化委员会,http://www.miit.gov.cn,,
物流机器人,移动机器人,高效路径规划、自动充电,仓储管理、配送,字符型,中国物流与采购联合会,https://www.cflp.org.cn,,
医疗机器人,机器人手术系统,远程操作、视觉增强,微创手术,字符型,中国医学科学院,http://www.cams.ac.cn,,
娱乐机器人,智能移动平台,语音识别、情绪交互,家庭娱乐、陪伴,字符型,人工智能产业发展联盟,http://www.aiai.org.cn,,
农业机器人,无人播种机,自动化播种、土壤分析,大田作物种植,字符型,中国农业科学院,http://www.caas.cn,,
教育机器人,互动学习平台,基于AI、个性化学习,儿童编程教育,字符型,中国教育研究院,http://www.nier.edu.cn,,
特种机器人,救援机器人,灾害应对、目标识别,地震救援,字符型,国家自然灾害应急救援中心,http://www.nchcg.gov.cn,,
人形机器人,仿生结构,高自由度、情感表达,陪护服务,字符型,中国机器人产业生态联盟,https://www.robotics.org.cn,,
工业机器人,对焊机器人,高强度、精确操作,金属加工,字符型,中国机械工业联合会,http://www.cmif.org.cn,,
服务机器人,导航机器人,激光测距、自主导航,酒店服务,字符型,中国服务机器人协会,http://www.csra.org.cn,,
清洁机器人,扫地机器人,智能感应、自动清扫,家庭清洁,字符型,中国家电协会,http://www.cheaa.org,,
物流机器人,移动机器人,智能避障、路径规划,仓储、配送,字符型,智慧物流研究中心,https://www.smartlogistics.org,,
医疗机器人,全身式机械手,实时监控、精确控制,康复治疗、远程手术,字符型,中国卫生信息协会,https://www.chinahealthinfo.org,,
服务机器人,人形设计,情感识别、语音交互,陪伴、助老,字符型,人工智能研究院,https://www.airesearch.org,,
农业机器人,多功能播种机,精准施肥、气候适应,智能种植、农田监测,字符型,现代农业发展基金,https://www.modernagriculture.org,,
特种机器人,水下探测器,深海探测、数据采集,海洋研究、搜救,字符型,国家海洋局,https://www.soa.gov.cn,,
教育机器人,编程平台,趣味教学、互动体验,编程教育、STEM课程,字符型,国家教育部,https://www.edu.cn,,
环境监测机器人,移动传感器平台,实时数据传输、环境适应,空气质量监测、污染检测,字符型,环境保护部,https://www.mep.gov.cn,,
智能清洁机器人,自动清扫系统,自主管理、路径优化,家庭清洁、商业物业,字符型,智能家居协会,https://www.smart-home.org.cn,,
娱乐机器人,声控系统,多媒体互动、个性化服务,娱乐场所、家庭陪伴,字符型,人工智能娱乐协会,https://www.aientertainment.org,,
安全巡逻机器人,移动监控系统,视频监控、自动警报,社区安防、商业监控,字符型,公共安全研究院,https://www.publicsafety.org.cn,,
物流机器人,自动导航系统,实时定位、路径优化,仓库管理,字符型,中国物流与采购联合会,https://www.chinawuliu.com.cn,,
教育机器人,仿生设计,情感识别、互动学习,早教、编程教育,字符型,中国科学技术协会,https://www.cast.org.cn,,
海底机器人,深海探测器,高压力适应能力,海洋调查、矿产资源勘探,字符型,国家海洋局,http://www.soa.gov.cn,,
娱乐机器人,轮式运动平台,语音交互、情景反应,玩具、展示,字符型,中国玩具协会,https://www.ctjpa.org.cn,,
巡逻机器人,四轮驱动,人工智能监控、实时报告,街区安全、企业安保,字符型,公安部,http://www.mps.gov.cn,,
人形机器人,双足行走系统,高仿真、社交能力,陪伴、客户服务,字符型,杭州未来科技城,http://www.hzfut.com,,
清洁机器人,智能识别系统,自主清扫、障碍物识别,公共场所清洁、家用,字符型,中国家庭服务业协会,http://www.chfa.org.cn,,
农业无人机,多旋翼设计,精准喷洒、数据收集,作物监测、精准施肥,字符型,农业农村部,http://www.moa.gov.cn,,
建设机器人,自动化设备,高效率、工地安全监控,建筑施工、危险区域操作,字符型,住房和城乡建设部,http://www.mohurd.gov.cn,,
救援机器人,全地形底盘,强大的负重能力、环境适应性,灾害救援、事故现场监测,字符型,国家应急管理部,http://www.mem.gov.cn,,
清洁机器人,移动底盘,自动充电、路径规划,商业清洁、家庭清洁,字符型,中国智能清洁行业协会,https://www.cleanchina.org,,
物流机器人,模块化设计,智能调度、导航,仓库管理、快递运送,字符型,中国物流与采购联合会,https://www.cflp.org.cn,,
救援机器人,多功能移动平台,远程操控、环境监测,紧急救助、灾后重建,字符型,国家自然灾害救援专家委员会,https://www.ncdma.gov.cn,,
娱乐机器人,交互式设计,语音识别、表情反应,家庭陪伴、教育玩具,字符型,中国玩具和婴童用品协会,https://www.ctj.com.cn,,
安防机器人,固定监控系统,实时监控、入侵检测,智能建筑、社区安防,字符型,国家公共安全部门,https://www.mps.gov.cn,,
康复机器人,可穿戴结构,辅助运动、可调节性,物理治疗、运动康复,字符型,国家卫生健康委员会,https://www.nhc.gov.cn,,
无人机,固定翼设计,航拍、远程操控,农业监测、地理勘查,字符型,中国航空工业集团,http://www.avic.com,,
家居机器人,小型移动平台,自我学习、家电控制,智能家居控制、生活助手,字符型,中国人工智能产业发展联盟,https://www.caai.cn,,
巡逻机器人,全地形底盘,环境感知、自动巡逻,军事、保安,字符型,中国军事科学研究院,http://www.amoy.edu.cn,,
宠物机器人,生物仿生设计,情感交互、反应灵敏,家庭娱乐、陪伴服务,字符型,中国机器人技术研究中心,https://www.robotics.org.cn,,
智能家居机器人,固定基础与移动平台,语音控制、智能学习,家庭安全、智能监控,字符型,智能家居研究中心,https://www.smart-home.com,,
无人机,四旋翼设计,实时监控、长续航,农业监测、物流配送,字符型,中国无人机协会,https://www.uca.org.cn,,
仓储机器人,移动自主导航,高效存取、智能识别,物流运输、仓库管理,字符型,仓储技术研究所,https://www.warehousetech.org,,
巡逻机器人,轮式移动底盘,视频监控、环境感知,安全巡逻、公共场所监测,字符型,公共安全部,https://www.publicsafety.gov,,
外科手术机器人,机械手臂与视像系统,微创、高精度,复杂手术、远程手术,字符型,国家医学委员会,https://www.nhc.gov.cn,,
教育机器人,模块化编程平台,可编程、开放式接口,编程教育、STEM培训,字符型,中国教育机器人协会,https://www.credentialeducation.com,,
救援机器人,全地形平台,强适应性、远程操控,灾难救援、搜索作业,字符型,国家应急管理部,https://www.mem.gov.cn,,
物流机器人,拼接式车身,智能调度、自动导航,货物搬运、分拣作业,字符型,物流协会,https://www.logisticsassociation.org,,
养老护理机器人,移动交互机器人,情感交互、健康监测,居家养老、医疗陪护,字符型,老龄化社会研究中心,https://www.ageingresearch.com,,
清洁机器人,圆形自走式设计,智能规划、自动充电,室内清洁、商业保洁,字符型,中国清洁行业协会,https://www.cleaningindustry.org,,
智能家居机器人,联网控制系统,远程操控、安全监测,家庭安防、智能家电控制,字符串,智能家居协会,https://www.smarthome.org,,
快递配送机器人,自走式底盘,自动行驶、路径规划,城市配送、餐饮外卖,字符串,中国物流与采购联合会,http://www.clc.org.cn,,
无人机,多旋翼设计,高机动性、航拍功能,农业监测、城市规划,字符串,中国民用航空局,http://www.caac.gov.cn,,
护理机器人,移动底盘与机械臂,陪伴、日常护理,老人护理、康复辅导,字符串,国家老龄化发展研究中心,http://www.cnlss.gov.cn,,
清洁机器人,全方位传感器,自主清扫、增强学习,家庭清理、商业空间清洁,字符串,中国机械工业联合会,http://www.cmif.org.cn,,
探险机器人,耐高温外壳,适应极端环境、遥控操作,火灾现场、深海探测,字符串,国家科技部,http://www.most.gov.cn,,
娱乐机器人,社交交互系统,语音识别、情感交流,孩子玩具、家庭伴侣,字符串,国际机器人展,http://www.irex.org,,
手术机器人,高精度机械手,高级成像、微创手术,外科手术、治疗程序,字符串,国家医学科学院,http://www.nm.china.com,,
建筑机器人,多功能操控系统,施工自动化、材料搬运,建筑工地、基础设施建设,字符串,中国建筑协会,http://www.china-construct.com,,
物流机器人,模块化车身,路线优化、智能分拣,仓库管理、货物分配,字符串,中国仓储协会,http://www.cwa.org.cn,,
服务机器人,移动底盘,语音识别、情感交互,老人护理、陪伴,字符型,科技日报,https://www.stdaily.com,,
无人机,四旋翼设计,高空拍摄、实时监控,农业监测、城市规划,字符型,中国无人机产业网,https://www.cuaa.org.cn,,
教育机器人,可编程小车,模块化、趣味性,STEAM教育、编程学习,字符型,机器人教育研究中心,https://www.edu-robotics.cn,,
医疗机器人,手术机器人,远程操作、精准定位,远程手术、复杂操作,字符型,医药科学杂志,https://www.medsci.cn,,
工业机器人,协作机械臂,人机协作安全、灵活性,组装、质检,字符型,中国机器人研究所,https://www.roboticsinstitute.cn,,
物流机器人,自动导引车(AGV),路径规划、自主导航,仓储物流、物料运输,字符型,物流技术与应用,https://www.logisticsjournal.cn,,
特种机器人,水下探测器,耐压、深海探测,海洋科学、资源勘探,字符型,海洋研究机构,https://www.oceanicresearch.cn,,
农业机器人,无人拖拉机,自动化种植、精准施肥,大规模农田作业,字符型,农业科技杂志,https://www.agri-tech.cn,,
安防机器人,巡逻机器人,移动监控、实时警报,公共安全、事件监控,字符型,中国安防技术网,https://www.security.cn,,
娱乐机器人,舞蹈机器人,表情互动、舞蹈编程,表演、互动展览,字符型,演艺科技论坛,https://www.performance-tech.cn,,
物流机器人,移动平台,扫描定位、智能避障,仓库管理、配送服务,字符型,京东物流,https://www.jd.com,,
服务机器人,固定基座,人脸识别、情感交互,酒店接待、购物中心,字符型,中国服务机器人协会,https://www.csra.org.cn,,
农业机器人,无人机,喷洒农药、数据采集,农作物监测、精准施肥,字符型,农业科技杂志,https://www.agriculturaljournal.com,,
教育机器人,载体平台,语音识别、学习辅导,线上课堂、辅导学习,字符型,百度教育,https://edu.baidu.com,,
医疗机器人,桌面机器人,实时数据监控、远程诊断,病人监测、家庭护理,字符型,中国医疗器械行业协会,https://www.cmeia.org,,
社区助理机器人,移动导航系统,社区服务、老人陪伴,社区管理、老年关怀,字符型,国家老龄办,http://www.ageing.gov.cn,,
救援机器人,轮式平台,高强度作业、环境探测,灾难现场、搜索救援,字符型,中国红十字会,https://www.redcross.org.cn,,
清洁机器人,自走式清扫,自动充电、路径规划,室内外清洁,字符型,智能家居研究中心,https://www.smart-home.cn,,
科研机器人,实验室手臂,高精度、可调节吃重,科学实验、样本分析,字符型,中国科学院,http://www.cas.cn,,
娱乐机器人,交互台,表演、互动娱乐,主题公园、展览活动,字符型,网易科技,https://tech.163.com,,
服务机器人,轮式移动平台,多语言支持、云连接,酒店接待、导览,字符型,中国服务机器人产业协会,https://www.csria.org.cn,,
工业机器人,并联机器人,高速、高负载,电子组装、搬运,字符型,工信部,https://www.miit.gov.cn,,
医药机器人,可穿戴装置,实时数据监测,病人监控、药物管理,字符型,国家药品监督管理局,https://www.nmpa.gov.cn,,
教育机器人,人形设计,情感交互、学习能力,编程教学、互动学习,字符型,中国教育科学研究院,http://www.cnerd.gov.cn,,
家务机器人,全方位吸尘器,智能规划、自动充电,清洁、家居管理,字符型,智能家居研究中心,https://www.smarthome.org.cn,,
农业机器人,无人驾驶拖拉机,精准播种、数据分析,大田耕作、农业监控,字符型,农业经济研究所,http://www.aeri.org.cn,,
娱乐机器人,遥控模型,可塑性、创意编程,比赛、教育演示,字符型,国际机器人博览会,https://www.robotexhibition.com,,
军用机器人,地面无人侦察系统,隐身、长续航,战场监控、侦察任务,字符型,中国人民解放军技术研究院,http://www.71.cn,,
特种机器人,水下遥控设备,深水探测、视频实时传输,海洋研究、救援行动,字符型,国家海洋局,http://www.soa.gov.cn,,
危险环境机器人,遥控多功能车,抗辐射、远程操控,核设施监测、探测危险物,字符型,国家核安全局,http://www.cnnrc.gov.cn,,
物流机器人,自动导航车,高效运输、实时定位,仓库管理、配送服务,字符型,物流与供应链协会,https://www.lsca.org,,
清洁机器人,智能扫地机,自动清扫、路径规划,家庭清洁、商用卫生,字符型,家电网,https://www.homeappliance.org,,
人形机器人,双足步态系统,人机交互、情感表达,陪伴、助老,字符型,机器人技术论坛,https://www.robotechforum.com,,
水下机器人,水下无人机,深水作业、高清摄像,海洋探测、环境监测,字符型,海洋研究所,https://www.oceaninstitute.org,,
娱乐机器人,可编程玩具,音效互动、编程教育,儿童教育、娱乐,字符型,玩具行业协会,https://www.toyassociation.org,,
社交机器人,有效通讯系统,情感识别、多语言支持,社会交互、商业助手,字符型,智能科技博览会,https://www.techfair.org,,
安防机器人,全景监控系统,实时监控、智能报警,公共安全、家庭监控,字符型,安全技术研究中心,https://www.securitytech.org,,
农业巡检机器人,全地形机器人,数据采集、农田检测,作物监测、土壤分析,字符型,农业科技杂志,https://www.agritechmag.com,,
辅助移动机器人,轮式移动平台,人机协作、自主导航,老年护理、医疗辅佐,字符型,医学机器人协会,https://www.medrobotics.org,,
机器人艺术家,机器人手臂,创意绘画、自动创作,艺术展示、教学,字符型,数字艺术平台,https://www.digitalart.org,,
工业机器人,并联机器人,高速、稳定性高,电子产品组装,字符型,电子行业协会,https://www.eia.gov.cn,,
服务机器人,智能轮式底盘,多功能、语音识别,餐饮服务、地产展示,字符型,中国服务机器人产业技术创新战略联盟,https://www.csric.org.cn,,
医疗机器人,柔性机器人手,人机协作、数据收集,康复治疗、药物分配,字符型,国家医疗卫生研究院,https://www.nhri.gov.cn,,
农业机器人,无人驾驶拖拉机,适应性强、智能监控,田间管理、作物监测,字符型,中国农业科学院,https://www.caas.cn,,
教育机器人,可编程编队,实践性强、激发创造力,编程教育、STEM教育,字符型,科技部,https://www.most.gov.cn,,
特种机器人,多模态探测器,强智能感知、实时监测,地质勘探、环境监测,字符型,中国科学技术协会,https://www.cast.org.cn,,
物流机器人,自动引导车(AGV),路径规划、自主导航,仓库自动化、配送中心,字符型,物流技术协会,https://www.logistics.org.cn,,
救援机器人,遥控操作平台,高流动性、远程操控,灾难现场救援、火灾救助,字符型,国家消防救援局,https://www.mnr.gov.cn,,
产品检验机器人,机视觉检测系统,高精度、全面检测,质量控制、零件检验,字符型,国家市场监督管理总局,https://www.samr.gov.cn,,
环保机器人,水下作业机器人,抗压强、长续航,水质监测、海洋调查,字符型,生态环境部,https://www.mee.gov.cn,,
服务机器人,人形设计,语音识别、情感交互,老年人护理、陪伴,字符型,科技日报,https://www.stdaily.com,,
