云端数据分析技术,智能家电,云服务器,8,分析用户行为优化家电的使用习惯,海尔,字符型,消费电子期刊,https://www.haier.com,,
情境叙事技术,娱乐机器人,音频处理模块,7,通过智能叙事提升玩家的沉浸感,蚂蚁科技,字符型,娱乐技术论坛,https://www.antgroup.com,,
疫苗接种机器人技术,公共卫生,自动注射系统,10,在疫情期间提供快速准确的疫苗接种服务,Medtronic,字符型,医疗科技报道,https://www.medtronic.com,,
可变形机器人技术,灾难救援,形态转换组件,9,适应复杂环境进行救援操作,普渡大学,字符型,灾难管理学术期刊,https://www.purdue.edu,,
智能物流调度技术,供应链管理,调度优化算法,9,基于大数据分析进行物流资源的最优配置,顺丰,字符型,物流行业分析,https://www.sf-express.com,,
仿生机器人技术,海洋探测,水下推进器,8,用于海洋生物观察和环境研究,海洋探测科技,字符型,环境科学期刊,https://www.oceanexploration.com,,
情感识别技术,智能客服,情感分析模块,8,识别用户情绪并自动调整交互方式,腾讯,字符型,科技论坛,https://www.tencent.com,,
增强现实导航技术,智能交通,AR眼镜,9,在驾驶过程中提供增强现实导航信息,谷歌,字符型,行业分析报告,https://www.google.com,,
协作机器人技术,制造业,多关节机械手臂,9,实现人与机器的安全协作,ABB,字符型,自动化期刊,https://global.abb,,
视觉定位技术,无人机,相机模块,8,提升无人机在复杂环境中的自主定位能力,大疆创新,字符型,科技新闻网站,https://www.dji.com,,
智能推荐系统,电子商务,数据分析平台,9,根据用户行为推荐个性化产品,京东,字符型,市场调研报告,https://www.jd.com,,
自动驾驶仿真技术,汽车制造,仿真软件,10,用于测试和验证自动驾驶算法,特斯拉,字符型,科学报告,https://www.tesla.com,,
移动机器人导航技术,家庭自动化,激光传感器,7,提升智能家居设备的自主导航能力,iRobot,字符型,消费者科技展,https://www.irobot.com,,
安全监控识别技术,城市安全,高解析摄像机,10,增强城市安全监控的准确性,海康威视,字符型,行业论坛,https://www.hikvision.com,,
飞行自动化系统,无人机,飞控系统,8,实现无人机的自主飞行和任务规划,亿航智能,字符型,无人机研究论文,https://www.ehang.com,,
机器人视觉系统,工业生产,3D相机,9,提高机器人在物体识别和分类中的效率,索尼,字符型,电子科技杂志,https://www.sony.com,,
性能优化算法,嵌入式系统,微控制器,8,提升机器人运行效率和能耗管理,英特尔,字符型,技术大会,https://www.intel.com,,
动态环境适应技术,服务机器人,环境传感器,9,帮助机器人在变化环境中自我调整,波士顿动力,字符型,机器人展览,https://www.bostondynamics.com,,
数据融合技术,大数据分析,数据库管理系统,8,将多种数据源整合，提高决策质量,SAP,字符型,专业数据分析论坛,https://www.sap.com,,
自适应学习算法,教育机器人,学习处理单元,9,机器人根据学生反馈调整教学内容,好未来,字符型,教育科技报告,https://www.100tal.com,,
高效能源管理技术,绿色科技,电池管理系统,9,优化机器人操作中的能源使用效率,宁德时代,字符型,可再生能源杂志,https://www.catl.com,,
智能归纳推理技术,认知计算,推理引擎,10,提升机器人在不确定条件下的决策能力,阿里巴巴,字符型,前沿科技研究,https://www.alibaba.com,,
智能电池管理技术,新能源汽车,高效电池,8,提升电动车的续航能力和安全性能,小鹏汽车,字符型,汽车技术评估,https://www.xiaopeng.com,,
增强现实导航技术,智能交通,AR眼镜,8,提升驾驶员在复杂交通环境下的导航体验,摩托罗拉,字符型,科技新闻网站,https://www.motorola.com,,
人机协作机器人技术,制造业,传感器阵列,9,优化人机共工环境下的效率和安全,ABB,字符型,产业白皮书,https://global.abb,,
智能情感识别技术,客户服务,情感识别模块,7,让机器人能够识别和响应用户情绪,腾讯,字符型,人工智能研究期刊,https://www.tencent.com,,
无人配送技术,物流配送,无人机,8,实现高效、安全的城市配送,京东物流,字符型,行业分析报告,https://www.jd.com,,
智能监控系统,安全防范,4K监控摄像头,9,提供实时监控与安全分析,海康威视,字符型,技术论坛,https://www.hikvision.com,,
虚拟现实培训系统,教育培训,VR头盔,8,提供沉浸式技能培训环境,Facebook,字符型,教育科技报告,https://www.facebook.com,,
智能家居控制系统,智能家居,中控主机,8,实时监控和操控家居设备,小米,字符型,科技资讯网站,https://www.mi.com,,
智能情感朗读技术,人机交互,语音合成模块,9,提供个性化、情感化的语音反馈,百度,字符型,AI技术博客,https://www.baidu.com,,
自主学习机器人技术,服务机器人,学习算法模块,10,使机器人具备自我学习和适应的能力,波士顿动力,字符型,机器人技术杂志,https://www.bostondynamics.com,,
智能能源管理系统,智能电网,传感器网络,9,为能源使用优化提供实时数据分析,西门子,字符型,能源管理白皮书,https://www.siemens.com,,
机器人视觉识别技术,工业自动化,图像处理单元,8,提高机器人在复杂环境中的物体识别能力,索尼,字符型,科技展览报告,https://www.sony.com,,
多模态交互技术,人机互动,多传感器融合模块,7,提升设备在多种输入模式下的交互体验,华为,字符型,智能科技研究,https://www.huawei.com,,
区域智能监控技术,智能安防,网络摄像头,9,保障特定区域的安全监控和实时反馈,大华股份,字符型,行业标准发布,https://www.dahuasecurity.com,,
高效能源回收技术,绿色科技,能源回收系统,10,大幅提升机器人的能源自主管理能力,特斯拉,字符型,环境保护研究,https://www.tesla.com,,
AI驱动的个性化推荐系统,电子商务,推荐引擎,9,根据用户行为为其定制购物建议,阿里巴巴,字符型,市场趋势分析,https://www.alibaba.com,,
可再生能源集成技术,能源管理,可再生能源管理系统,9,实现多种可再生能源的集成与优化管理,GE,字符型,可再生能源报告,https://www.ge.com,,
智能农田监测技术,农业科技,土壤传感器,8,提供实时土壤状况分析与预警,AgraTech,字符型,农业科技创新论坛,https://www.agratech.com,,
增强现实导航技术,智能交通,AR眼镜,8,通过增强现实提供实时街景导航信息,Uber,字符型,科技趋势报告,https://www.uber.com,,
智能语音助手技术,智能家居,智能音箱,9,允许用户通过语音指令控制家居设备,亚马逊,字符型,人工智能新闻,https://www.amazon.com,,
机器学习优化算法,金融科技,数据处理芯片,10,提高风险评估和交易决策能力,蚂蚁集团,字符型,金融技术论坛,https://www.antgroup.com,,
情感识别技术,客服机器人,情感分析模块,8,帮助机器人识别并回应用户的情感,IBM,字符型,业界发布,https://www.ibm.com,,
智能农业系统,农业科技,无人机,9,通过数据收集和分析提升农业生产效率,大疆科技,字符型,农业科技期刊,https://www.dji.com,,
多模态交互技术,人机交互,传感器模块,7,允许多种输入方式与机器人进行交互,微软,字符型,技术创新论坛,https://www.microsoft.com,,
智能回收系统,环保技术,传感器,9,通过智能识别和分类改进废物回收效率,Tomra,字符型,环保科技周刊,https://www.tomra.com,,
无障碍机器人技术,医疗辅助,沿墙导航传感器,10,提升行动不便人士的生活质量,Toyota,字符型,医疗与健康杂志,https://www.toyota-global.com,,
高级视觉系统,自动驾驶,立体相机,10,提高车辆对于周围环境的识别能力,Waymo,字符型,自动驾驶产业报告,https://waymo.com,,
自学习机器人技术,教育科技,智能处理器,8,通过学习适应用户需求的教育机器,SoftBank Robotics,字符型,教育科技展览会,https://www.softbankrobotics.com,,
无人机配送技术,物流运输,电池系统,9,实现快速高效的无人机货物配送,飞燕科技,字符型,物流技术会议,https://www.flightsky.com,,
协作式机器人技术,制造业,力反馈手柄,9,提高人与机器人之间的协调工作能力,ABB,字符型,制造业技术论坛,https://global.abb,,
虚拟培训模拟系统,培训行业,VR头显,8,为新员工提供沉浸式培训体验,Facebook,字符型,培训与发展月刊,https://www.faceboook.com,,
智能清洁机器人技术,家居服务,动力电池,7,自动清洗家居环境的一款智能机器人,iRobot,字符型,消费电子展,https://www.irobot.com,,
集成电路设计优化,半导体,ASIC芯片,9,提升机器人操作中的计算效率,中芯国际,字符型,电子科技月刊,https://www.smics.com,,
智能健康监测技术,医疗健康,生理传感器,9,实时监测用户健康数据并提供反馈,飞利浦,字符型,医学创新论坛,https://www.philips.com,,
生物识别技术,安防监控,生物识别传感器,10,提供先进的身份验证和监控解决方案,荣耀,字符型,安防行业报告,https://www.honor.cn,,
增强现实智能助手,教育科技,AR头显,8,提升学生在学习过程中的互动体验,字节跳动,字符型,科技前沿报告,https://www.bytedance.com,,
电池管理系统,智能电动车,电池监控模块,9,延长电池使用寿命并提高安全性,蔚来,字符型,新能源产业白皮书,https://www.nio.com,,
情感识别技术,人机交互,生物传感器,8,识别并响应用户的情绪状态,阿里巴巴,字符型,人工智能行业报告,https://www.alibabagroup.com,,
人机协作技术,制造业,智能操作机械臂,10,提高生产线的灵活性和效率,ABB,字符型,工业自动化杂志,https://global.abb,,
智能物流机器人,仓储管理,导航传感器,9,实现高效的货物搬运与配送,京东物流,字符型,物流技术年鉴,https://www.jd.com,,
自主学习算法,服务机器人,智能芯片,10,使机器人具备自我学习和适应能力,英伟达,字符型,机器学习会议记录,https://www.nvidia.com,,
环境感知技术,交通管理,多传感器融合系统,9,实时监测交通状况以优化行车决策,百度,字符型,智能交通论坛,https://www.baidu.com,,
智能灌溉系统,农业科技,湿度传感器,8,自动监测并控制灌溉需求,华为,字符型,农业现代化杂志,https://www.huawei.com,,
虚拟现实交互技术,娱乐科技,VR控制器,7,提供沉浸式用户体验和互动,索尼,字符型,游戏开发活动报告,https://www.sony.com,,
透明显示技术,消费电子,OLED显示屏,9,提供新的用户界面显示方式,LG电子,字符型,电子产品报告,https://www.lg.com,,
情境意识技术,智能家居,智能传感器,8,根据环境变化自动调节设备,小米,字符型,家庭科技设备趋势,https://www.mi.com,,
语音合成技术,媒体科技,AI音频处理模块,7,生成自然流畅的语音输出,腾讯,字符型,科技评论,https://www.tencent.com,,
智能排班系统,人力资源管理,算法引擎,8,自动优化员工排班以提高效率,SAP,字符型,企业管理期刊,https://www.sap.com,,
智能语音助手,智能家居,语音识别芯片,9,管理家电和提供实时信息,亚马逊,字符型,产品评测网站,https://www.amazon.com,,
网络安全防护技术,信息技术,入侵检测系统,10,保护用户数据免受网络攻击,奇安信,字符型,网络安全论坛,https://www.qianxin.com,,
智能健康监测技术,医学科技,生理监测设备,10,实时监测健康数据并提供反馈,Philips,字符型,医疗技术报告,https://www.philips.com,,
语音翻译技术,跨语言交流,实时翻译设备,9,在多个语言之间实时翻译交流,Google,字符型,科技创新报告,https://www.google.com,,
机器视觉技术,工业自动化,图像传感器,9,通过图像识别实现产品质量检测和缺陷识别,海康威视,字符型,行业研究机构,https://www.hikvision.com,,
增材制造技术,制造业,3D打印机,8,通过3D打印技术快速生产复杂设计的零部件,大族激光,字符型,制造业报告,https://www.comau.com,,
情感识别技术,智能客服,情感分析软件,7,帮助机器人理解用户情绪以提供个性化服务,百度,字符型,国际会议论文集,https://www.baidu.com,,
智能移动机器人技术,物流运输,移动底盘,9,提高物流配送的自动化和智能化水平,丰巢科技,字符型,物流科技期刊,https://www.fengcha.com,,
智能情境感知技术,智能家居,环境传感器,8,通过对环境的实时监测提升家居安全性,云米科技,字符型,科技财经频道,https://www.umiwi.com,,
能源管理系统,智慧城市,电力监测仪,9,优化城市能源消耗，提升可持续性,南方电网,字符型,可持续发展期刊,https://www.csg.cn,,
多模态学习技术,人工智能,数据融合模块,8,提高AI在多种输入数据下的学习效果,腾讯AI Lab,字符型,人工智能行业报告,https://ai.tencent.com,,
智能协作技术,制造业,协作机器人,10,实现人机协作，提升生产效率,ABB,字符型,自动化及控制工程,https://global.abb,,
自然语言生成技术,内容创作,文本生成模型,9,为用户提供自动化的内容生成服务,OpenAI,字符型,技术白皮书,https://www.openai.com,,
基于区块链的身份验证技术,金融科技,区块链网络,8,提供去中心化的身份验证方案,蚂蚁集团,字符型,区块链技术论坛,https://www.antgroup.com,,
智能传感网络技术,城市管理,无线传感器节点,9,通过传感器实现城市数据的实时采集与分析,华为,字符型,城市创新大会,https://www.huawei.com,,
量子计算技术,科研计算,量子处理器,10,提升数据计算速度，解决复杂问题,IBM,字符型,科技前沿论坛,https://www.ibm.com,,
移动边缘计算技术,云计算,边缘计算设备,7,提高数据处理速度与效率，尤其是在5G应用中,思科系统,字符型,网络安全周刊,https://www.cisco.com,,
虚拟现实和增强现实技术,娱乐与游戏,AR眼镜,8,提供沉浸式体验，激发用户创意,字节跳动,字符型,技术创新杂志,https://www.bytedance.com,,
智能交通管理技术,交通运输,交通信号控制系统,9,减少交通拥堵，提高通行效率,小米科技,字符型,交通科技报告,https://www.xiaomi.com,,
智能农业技术,农业,自动灌溉系统,8,通过智能化技术提高农业生产的效率,中科院农业研究所,字符型,农业科技会议,https://www.caas.cn,,
云机器人技术,服务机器人,云计算平台,10,通过云计算增强机器人智能，提供更好的服务,索尼,字符型,服务机器人大会,https://www.sony.com,,
智能药物分发系统,医疗,药物释放设备,9,提升药物管理效率和病人用药安全,阿斯利康,字符型,医疗科技期刊,https://www.astrazeneca.com,,
增强现实技术,娱乐与游戏,头戴显示器,8,通过虚拟元素增强用户的沉浸体验,Meta,字符型,科技新闻网站,https://www.meta.com,,
云机器人技术,家庭服务,智能音箱,7,通过云计算提升家庭机器人智能水平,亚马逊,字符型,市场分析报告,https://www.amazon.com,,
视觉寻踪技术,无人机监控,光学传感器,9,实现无人机对目标的自动追踪与监控,大疆创新,字符型,行业评估报告,https://www.dji.com,,
边缘计算技术,智能城市,边缘设备,9,实时处理城市各类传感器数据，提升响应速度,思科,字符型,技术白皮书,https://www.cisco.com,,
感知与认知系统,自动驾驶,传感器融合模块,10,让无人驾驶车辆更好地理解周边环境,Waymo,字符型,行业分析报告,https://www.waymo.com,,
机器人过程自动化,商业智能,软件机器人,8,自动化重复性任务，提高工作效率,UiPath,字符型,行业研究报告,https://www.uipath.com,,
机器视觉技术,制造业,视觉处理单元,10,实现产品的自动检测和质量控制,百度,字符型,技术期刊,https://www.baidu.com,,
控制算法优化,航空航天,飞行控制器,9,提升飞行器的稳定性和安全性,波音,字符型,工程技术文章,https://www.boeing.com,,
智能巡逻机器人,公共安全,行为感知系统,9,在城市环境中进行安全巡逻和检测,软银机器人,字符型,安全技术报告,https://www.softbankrobotics.com,,
智能家居系统,家庭自动化,中央控制单元,8,整合家居设备，提升生活便利性,谷歌,字符型,家居技术评估,https://www.google.com,,
生物识别技术,安全认证,指纹扫描仪,10,提供高度安全的用户身份验证手段,掌握科技,字符型,安全行业报告,https://www.bioid.com,,
智能驾驶舱技术,汽车产业,人机交互界面,9,提升驾驶员与车辆的互动体验,宝马,字符型,汽车科技文章,https://www.bmw.com,,
云端服务机器人,教育,在线学习平台,8,提供个性化的在线学习支持,MOOC平台,字符型,教育研究报告,https://www.coursera.org,,
音频处理技术,智能助手,音频采集模块,7,提升语言助手的听觉识别性能,苹果公司,字符型,消费电子报告,https://www.apple.com,,
远程医疗机器人,医疗健康,高清摄像头,10,在远程情况下为医生提供诊疗服务,Intuitive Surgical,字符型,医疗技术报告,https://www.intuitive.com,,
自主学习系统,人工智能教育,机器学习模型,9,根据学生反馈调整学习内容,IBM,字符型,行业趋势分析,https://www.ibm.com,,
智能物流调度系统,仓储物流,调度管理软件,8,优化物流操作，降低成本,顺丰速运,字符型,物流行业趋势分析,https://www.sf-express.com,,
情感识别技术,社交机器人,情感分析算法,9,实现机器人对人类情感的理解与反馈,Affectiva,字符型,新兴科技研究,https://www.affectiva.com,,
多模态感知技术,自动驾驶,摄像头与传感器融合模块,9,结合视频和传感器信息，提高识别精度,Waymo,字符型,技术市场分析,https://waymo.com,,
人机协作技术,智能制造,协作机器人,8,使机器人与人类工人共同完成任务,Universal Robots,字符型,制造业报告,https://www.universal-robots.com,,
情感识别技术,智能客服,情感分析模块,7,识别用户情绪以提供个性化服务,IBM,字符型,科技资讯平台,https://www.ibm.com,,
智能视觉导航技术,智能安防,智能摄像头,10,在复杂环境中实时监控和导航,海康威视,字符型,市场研究报告,https://www.hikvision.com,,
生态适应算法,农业机器人,传感器网络,8,根据环境变化调整农业决策,Blue River Technology,字符型,农业科技期刊,https://bluerivertechnology.com,,
智能物流调度技术,物流与运输,配送管理系统,9,优化配送路线与时间管理,DHL,字符型,物流研究中心,https://www.dhl.com,,
虚拟现实技术,培训与教育,VR头显,7,提供沉浸式学习体验,Oculus,字符型,教育研究论坛,https://www.oculus.com,,
自学习机器人技术,家用服务,自适应算法,10,根据用户习惯自我优化操作,iRobot,字符型,家电行业报告,https://www.irobot.com,,
粒子群优化算法,智能制造,计算优化模块,8,有效地解决复杂生产调度问题,西门子,字符型,工程技术期刊,https://www.siemens.com,,
增强现实技术,医疗辅助,AR眼镜,9,现实场景中提供病理信息,Magic Leap,字符型,医学科技论坛,https://www.magicleap.com,,
人机交互界面,智能家居,触摸屏,7,通过直观界面实现家庭设备控制,Nest,字符型,智能家居行业报道,https://nest.com,,
自动视觉检测技术,质量控制,高分辨率摄像头,9,实现生产线产品的自动检测,Cognex,字符型,工业科技杂志,https://www.cognex.com,,
智能识别技术,安防监控,智能识别软件,10,在视频监控中识别并报警,锐明技术,字符型,安防行业分析,https://www.recon.com,,
云端数据分析技术,智能医疗,云计算平台,8,为医疗数据提供实时分析,Salesforce,字符型,健康科技展览,https://www.salesforce.com,,
智能移动平台,仓储与配送,移动底盘,9,自动化物品在仓库内的搬运,Fetch Robotics,字符型,市场调研报告,https://fetchrobotics.com,,
异构多核处理技术,机器人系统,处理器,8,提高机器人数据处理效率,AMD,字符型,电子产品大会,https://www.amd.com,,
增强学习算法,人工智能,运算处理单元,9,通过学习提高决策能力,OpenAI,字符型,AI技术论坛,https://openai.com,,
精准医疗机器人技术,医疗健康,自适应手术刀,9,提高外科手术的准确性和安全性,达芬奇医疗,字符型,医学科技杂志,https://www.intuitive.com,,
智能监测系统,农业自动化,土壤湿度传感器,8,实时监测土壤状况，为农作物提供精准灌溉,约翰迪尔,字符型,农业技术期刊,https://www.deere.com,,
协作机器人技术,制造业,力觉传感器,7,与人类工人协同完成复杂的装配任务,ABB,字符型,工程技术杂志,https://global.abb,,
智能交通管理系统,智慧城市,智能信号灯,10,优化城市交通流量，减少拥堵,恩智浦半导体,字符型,城市规划报告,https://www.nxp.com,,
无人机物流配送技术,物流与运输,高效电池组,9,实现快速、高效的城市配送服务,亚马逊,字符型,电商行业研究,https://www.amazon.com,,
空间感知技术,自动驾驶,激光雷达传感器,10,帮助自动驾驶车辆理解周围环境,Waymo,字符型,机器人技术论坛,https://waymo.com,,
智能家居自动化技术,家庭服务,智能控制中心,8,通过手机应用控制家用设备,谷歌,字符型,消费者科技展,https://store.google.com,,
情感计算技术,教育科技,生理数据采集设备,7,能够识别和响应学生情绪,IBM,字符型,教育科技会议,https://www.ibm.com,,
智能维护与预测分析技术,工业自动化,数据分析平台,9,通过数据分析预测设备故障,西门子,字符型,工业物联网报告,https://www.siemens.com,,
人机协作平台,电子制造,智能连接模块,8,优化生产线上的人机协作流程,富士康,字符型,制造业白皮书,https://www.foxconn.com,,
环境感知技术,智能监控,传感器网络,8,实时监控环境变化和安全隐患,大华科技,字符型,安防行业指南,https://www.dahuatech.com,,
虚拟现实互动技术,娱乐行业,VR头显,9,提供沉浸式用户体验,Oculus,字符型,游戏信托报告,https://www.oculus.com,,
服务机器人导航系统,酒店和餐饮,SLAM算法模块,8,为餐厅提供自动化服务解决方案,Savioke,字符型,餐饮技术会议,https://www.savioke.com,,
机器视觉系统,自动化检测,CCD相机,10,用于产品质量监控与缺陷识别,康耐视,字符型,质量管理期刊,https://www.convision.com,,
信息融合技术,智能交通,信息处理单元,9,整合多种传感器数据提高交通决策,华为,字符型,智能交通年会,https://www.huawei.com,,
量子计算算法,金融科技,量子计算机,10,改善数据处理速度与精准度,谷歌量子AI,字符型,科技前沿大会,https://quantumai.google,,
交互式教育机器人,教育科技,教育应用平台,8,提供个性化学习体验,乐高教育,字符型,教育创新论坛,https://education.lego.com,,
开放式机器人平台,开发者社区,模块化组件,7,支持开发者创建定制机器人应用,RoboHub,字符型,开发者大会,https://www.robohub.org,,
智能物流机器人技术,仓储物流,导航传感器,9,自动进行货物搬运，提高仓库效率,亚马逊,字符型,行业技术报告,https://www.amazon.com,,
增强现实技术,教育培训,虚拟现实眼镜,8,通过增强现实为学生提供沉浸式学习体验,微软,字符型,科技新闻网站,https://www.microsoft.com,,
步态识别技术,智能安防,运动捕捉摄像头,7,通过分析步态实现个体身份识别,旷视科技,字符型,行业论坛,https://www.meituan.com,,
语音合成技术,智慧客服,语音生成模块,8,使机器人可以自然流畅地与客户沟通,百度,字符型,技术论文,https://www.baidu.com,,
多模态学习技术,人工智能,神经网络处理单元,9,整合多种数据类型以提升机器学习效果,华为,字符型,科研机构报告,https://www.huawei.com,,
人机协作技术,制造业,协作机器人臂,9,有效提高人工与机器人之间的合作效率,ABB,字符型,行业白皮书,https://global.abb,,
无人机自动配送技术,物流配送,高速摄像头,8,通过无人机实现自动化包裹配送,顺丰速运,字符型,商会报告,https://www.sf-express.com,,
智能边缘计算,物联网,边缘服务器,9,在边缘设备上进行实时数据处理与分析,思科,字符型,技术期刊,https://www.cisco.com,,
情感识别技术,心理健康,生物传感器,8,通过分析情感数据提供个性化心理健康建议,好心情科技,字符型,治疗技术期刊,https://www.haoxinqing.com,,
智能清洁机器人,清洁服务,超声波传感器,7,能够自动规划清洁路线并进行高效清洁,小米,字符型,消费者技术报告,https://www.mi.com,,
深度视觉系统,农业,高分辨率相机,10,监测作物生长状态，以优化农业决策,DJI,字符型,农业技术期刊,https://www.dji.com,,
智能交通管理技术,智能城市,数据收集器,9,基于实时数据优化交通流量,高德地图,字符型,城市规划报告,https://www.amap.com,,
虚拟助手技术,个人助理,智能音箱,8,提供个性化的语音助手服务,谷歌,字符型,科技评论,https://www.google.com,,
异构计算技术,数据中心,FPGA芯片,8,提高数据处理效率和能效,AMD,字符型,计算机科学期刊,https://www.amd.com,,
