应用行业,核心参数,技术说明,国外最高水平,国外主流水平,国内最高水平,国内主流水平,国内在研项目,采集来源,来源链接,采集时间,备注【疑问汇总】,,,,,,,,
医疗器械,精度 ±0.01 mm,用于高精度测量和诊断设备,美国GE医疗，精密度达到±0.005 mm,日本佳能，精度达到±0.01 mm,中国迈瑞，精度达到±0.02 mm,国内多家企业，精度达到±0.03 mm,基因测序仪研发,国家质量监督检验检疫总局,aqsiq.gov.cn,2024-10-11,,,,,,,,,
光学仪器,分辨率 1 nm,用于高分辨率成像和光谱分析,日本日立，分辨率可达0.5 nm,德国蔡司，分辨率可达1 nm,中国中科院，分辨率可达1.5 nm,国内多家企业，分辨率可达2 nm,超高分辨率显微镜研发,清华大学,tsinghua.edu.cn,2024-10-11,,,,,,,,,
测量仪器,精度 ±0.005 mm,用于工业自动化和精密测量,美国霍尼韦尔，精度达到±0.002 mm,德国西门子，精度达到±0.005 mm,中国华测，精度达到±0.01 mm,国内多家企业，精度达到±0.02 mm,高端传感器研发,工业和信息化部,miit.gov.cn,2024-10-11,,,,,,,,,
自动化设备,响应时间 <1 ms,用于快速响应的自动化控制系统,日本松下，响应时间可达0.5 ms,德国西门子，响应时间约1 ms,中国大恒，响应时间约1.5 ms,国内多家企业，响应时间约2 ms,智能控制系统研发,国家发改委,ndrc.gov.cn,2024-10-11,,,,,,,,,
精密加工机床,加工精度 ±0.001 mm,用于高端零件的加工,日本DMG MORI，加工精度±0.0005 mm,德国HAAS，加工精度±0.001 mm,中国秦川机床，加工精度±0.002 mm,国内多家企业，加工精度±0.003 mm,高端数控机床研发,哈尔滨工业大学,hit.edu.cn,2024-10-11,,,,,,,,,